PERIODO ACADEMICO,FACULTAD,CODIGO UNIDAD DE ESTUDIO,CODIGO DEL GRUPO,CREDITOS,TIPO DE OFERTA,TIPOLOGIA,DENOMINACION GRUPO,COD_DUMI_1,DUMI_1,COD_DUMI_2,DUMI_2,COD_DUMI_3,DUMI_3,COD_DUMI_4,DUMI_4,COD_DUMI_5,DUMI_5,COD_DUMI_6,DUMI_6,DIRECTOR UNIDAD DE ESTUDIO,FECHA INICIO,FECHA FINAL,HORA DE INICIO,HORA FINAL,LUNES,MARTES,MIERCOLES,JUEVES,VIERNES,SABADO,DOMINGO
2025-2,FAFCE,AFA00324,AFA00324C301,3,C3,NUCLEAR,ANALI DE LA INFORM FINANC C3G1,,,,,,,,,,,,,MATITUY TORRES DIEGO ARMANDO,21.07.2025,19.09.2025,20:00:00,21:59:00,LUNES N410 CALLE79,,,,VIERNES N410 CALLE79,,
2025-2,FAFCE,AFA00324,AFA00324C301,3,C3,NUCLEAR,ANALI DE LA INFORM FINANC C3G1,,,,,,,,,,,,,MATITUY TORRES DIEGO ARMANDO,23.07.2025,17.09.2025,20:00:00,21:59:00,,,MIERCOLES  ,,,,
2025-2,FAFCE,AFA00324,AFA00324C302,3,C3,NUCLEAR, ANALI DE LA INFORM FINANC C3G2,,,,,,,,,,,,,MATITUY TORRES DIEGO ARMANDO,21.07.2025,19.09.2025,10:00:00,11:59:00,LUNES  ,,MIERCOLES  ,,VIERNES  ,,
2025-2,FAFCE,AFA00324,AFA00324C401,3,C4,NUCLEAR, ANALI DE LA INFORM FINANC C4G1,,,,,,,,,,,,,MATITUY TORRES DIEGO ARMANDO,22.09.2025,21.11.2025,12:00:00,13:59:00,LUNES N412 CALLE79,,MIERCOLES N412 CALLE79,,VIERNES N412 CALLE79,,
2025-2,FAFCE,AFA00328,AFA00328C301,3,C3,NUCLEAR, CONTABILIDAD FINANCIERA C3G1,,,,,,,,,,,,,MATITUY TORRES DIEGO ARMANDO,21.07.2025,15.09.2025,18:00:00,19:59:00,LUNES  ,,,,,,
2025-2,FAFCE,AFA00328,AFA00328C301,3,C3,NUCLEAR, CONTABILIDAD FINANCIERA C3G1,,,,,,,,,,,,,MATITUY TORRES DIEGO ARMANDO,22.07.2025,18.09.2025,20:00:00,21:59:00,,MARTES N412 CALLE79,,JUEVES N412 CALLE79,,,
2025-2,FAFCE,AFA00328,AFA00328C302,3,C3,NUCLEAR, CONTABILIDAD FINANCIERA C3G2,,,,,,,,,,,,,MATITUY TORRES DIEGO ARMANDO,23.07.2025,19.09.2025,10:00:00,11:59:00,,,MIERCOLES  ,,VIERNES  ,,
2025-2,FAFCE,AFA00328,AFA00328C302,3,C3,NUCLEAR, CONTABILIDAD FINANCIERA C3G2,,,,,,,,,,,,,MATITUY TORRES DIEGO ARMANDO,21.07.2025,15.09.2025,10:00:00,11:59:00,LUNES N307 CALLE79,,,,,,
2025-2,FAFCE,AFA00328,AFA00328C401,3,C4,NUCLEAR, CONTABILIDAD FINANCIERA C4G1,,,,,,,,,,,,,MATITUY TORRES DIEGO ARMANDO,22.09.2025,21.11.2025,16:00:00,17:59:00,LUNES N411 CALLE79,,MIERCOLES N411 CALLE79,,VIERNES N411 CALLE79,,
2025-2,FAFCE,AFA00330,AFA00330C301,2,C3,NUCLEAR, CORPORATE FINANCE C3G1,,,,,,,,,,,,,MATITUY TORRES DIEGO ARMANDO,21.07.2025,17.09.2025,16:00:00,17:59:00,LUNES SAL_BLOOMB CALLE79,,MIERCOLES SAL_BLOOMB CALLE79,,,,
2025-2,FAFCE,AFA00330,AFA00330C401,2,C4,NUCLEAR, CORPORATE FINANCE C4G1,,,,,,,,,,,,,MATITUY TORRES DIEGO ARMANDO,22.09.2025,17.11.2025,18:00:00,19:59:00,LUNES SAL_BLOOMB CALLE79,,,,,,
2025-2,FAFCE,AFA00330,AFA00330C401,2,C4,NUCLEAR, CORPORATE FINANCE C4G1,,,,,,,,,,,,,MATITUY TORRES DIEGO ARMANDO,24.09.2025,19.11.2025,18:00:00,19:59:00,,,MIERCOLES  ,,,,
2025-2,FAFCE,AFA00330,AFA00330C402,2,C4,NUCLEAR, CORPORATE FINANCE C4G2,,,,,,,,,,,,,MATITUY TORRES DIEGO ARMANDO,24.09.2025,21.11.2025,12:00:00,13:59:00,,,MIERCOLES SAL_BLOOMB CALLE79,,VIERNES SAL_BLOOMB CALLE79,,
2025-2,FAFCE,AFA00331,AFA00331C301,3,C3,NUCLEAR, COSTOS Y PRESUPUESTOS C3G1,AFP00370C301,DUMI  COSTOS Y PRESUPUESTOS C3G1,,,,,,,,,,,MATITUY TORRES DIEGO ARMANDO,21.07.2025,19.09.2025,18:00:00,19:59:00,LUNES  ,,MIERCOLES  ,,VIERNES  ,,
2025-2,FAFCE,AFA00331,AFA00331C302,3,C3,NUCLEAR, COSTOS Y PRESUPUESTOS C3G2,AFP00370C302,DUMI  COSTOS Y PRESUPUESTOS C3G2,,,,,,,,,,,MATITUY TORRES DIEGO ARMANDO,21.07.2025,15.09.2025,14:00:00,15:59:00,LUNES L713 CALLE78,,,,,,
2025-2,FAFCE,AFA00331,AFA00331C302,3,C3,NUCLEAR, COSTOS Y PRESUPUESTOS C3G2,AFP00370C302,DUMI  COSTOS Y PRESUPUESTOS C3G2,,,,,,,,,,,MATITUY TORRES DIEGO ARMANDO,23.07.2025,19.09.2025,14:00:00,15:59:00,,,MIERCOLES  ,,VIERNES  ,,
2025-2,FAFCE,AFA00331,AFA00331C401,3,C4,NUCLEAR, COSTOS Y PRESUPUESTOS C4G1,AFP00370C401,DUMI  COSTOS Y PRESUPUESTOS C4G1,,,,,,,,,,,MATITUY TORRES DIEGO ARMANDO,23.09.2025,20.11.2025,18:00:00,19:59:00,,MARTES L801 CALLE78,,JUEVES L801 CALLE78,,,
2025-2,FAFCE,AFA00331,AFA00331C401,3,C4,NUCLEAR, COSTOS Y PRESUPUESTOS C4G1,AFP00370C401,DUMI  COSTOS Y PRESUPUESTOS C4G1,,,,,,,,,,,MATITUY TORRES DIEGO ARMANDO,26.09.2025,21.11.2025,18:00:00,19:59:00,,,,,VIERNES N614 CALLE79,,
2025-2,FAFCE,AFA00331,AFA00331C402,3,C4,NUCLEAR, COSTOS Y PRESUPUESTOS C4G2,AFP00370C402,DUMI  COSTOS Y PRESUPUESTOS C4G2,,,,,,,,,,,MATITUY TORRES DIEGO ARMANDO,22.09.2025,21.11.2025,16:00:00,17:59:00,LUNES N412 CALLE79,,MIERCOLES N412 CALLE79,,VIERNES N412 CALLE79,,
2025-2,FAFCE,AFA00335,AFA00335C301,2,C3,NUCLEAR, FINANZAS CORPORATIVAS C3G1,,,,,,,,,,,,,MATITUY TORRES DIEGO ARMANDO,24.07.2025,18.09.2025,16:00:00,17:59:00,,,,JUEVES L801 CALLE78,,,
2025-2,FAFCE,AFA00335,AFA00335C301,2,C3,NUCLEAR, FINANZAS CORPORATIVAS C3G1,,,,,,,,,,,,,MATITUY TORRES DIEGO ARMANDO,22.07.2025,16.09.2025,16:00:00,17:59:00,,MARTES N307 CALLE79,,,,,
2025-2,FAFCE,AFA00335,AFA00335C401,2,C4,NUCLEAR, FINANZAS CORPORATIVAS C4G1,,,,,,,,,,,,,MATITUY TORRES DIEGO ARMANDO,23.09.2025,20.11.2025,20:00:00,21:59:00,,MARTES N305 CALLE79,,JUEVES N305 CALLE79,,,
2025-2,FAFCE,AFA00338,AFA00338C401,2,C4,NUCLEAR, E BUSINESS MANAGEMENT C4G1,,,,,,,,,,,,,PASTRANA GRANADOS MONICA ALEJANDRA,26.09.2025,21.11.2025,18:00:00,19:59:00,,,,,VIERNES L901 CALLE78,,
2025-2,FAFCE,AFA00338,AFA00338C401,2,C4,NUCLEAR, E BUSINESS MANAGEMENT C4G1,,,,,,,,,,,,,PASTRANA GRANADOS MONICA ALEJANDRA,22.09.2025,17.11.2025,18:00:00,19:59:00,LUNES L701 CALLE78,,,,,,
2025-2,FAFCE,AFA00338,AFA00338C401,2,C4,NUCLEAR, E BUSINESS MANAGEMENT C4G1,,,,,,,,,,,,,PASTRANA GRANADOS MONICA ALEJANDRA,24.09.2025,19.11.2025,18:00:00,19:59:00,,,MIERCOLES N407 CALLE79,,,,
2025-2,FAFCE,AFA00349,AFA00349C301,4,C3,NUCLEAR, GESTION FINANC INTERN C3G1,,,,,,,,,,,,,MATITUY TORRES DIEGO ARMANDO,22.07.2025,18.09.2025,06:00:00,07:59:00,,MARTES SAL_BLOOMB CALLE79,,JUEVES SAL_BLOOMB CALLE79,,,
2025-2,FAFCE,AFA00349,AFA00349C301,4,C3,NUCLEAR, GESTION FINANC INTERN C3G1,,,,,,,,,,,,,MATITUY TORRES DIEGO ARMANDO,21.07.2025,19.09.2025,06:00:00,07:59:00,LUNES  ,,,,VIERNES  ,,
2025-2,FAFCE,AFA00349,AFA00349C401,4,C4,NUCLEAR, GESTION FINANC INTERN C4G1,,,,,,,,,,,,,MATITUY TORRES DIEGO ARMANDO,23.09.2025,18.11.2025,20:00:00,21:59:00,,MARTES  ,,,,,
2025-2,FAFCE,AFA00349,AFA00349C401,4,C4,NUCLEAR, GESTION FINANC INTERN C4G1,,,,,,,,,,,,,MATITUY TORRES DIEGO ARMANDO,22.09.2025,20.11.2025,20:00:00,21:59:00,LUNES SAL_BLOOMB CALLE79,,MIERCOLES SAL_BLOOMB CALLE79,JUEVES SAL_BLOOMB CALLE79,,,
2025-2,FAFCE,AFA00363,AFA00363S201,4,S2,NUCLEAR, GERENCIA DE MERCADEO S2G1,,,,,,,,,,,,,MORENO CEBALLOS HAIDY JOHANNA,23.07.2025,21.11.2025,18:00:00,19:59:00,,,MIERCOLES N705 CALLE79,,VIERNES N705 CALLE79,,
2025-2,FAFCE,AFA00363,AFA00363S202,4,S2,NUCLEAR, GERENCIA DE MERCADEO S2G2,,,,,,,,,,,,,MORENO CEBALLOS HAIDY JOHANNA,22.07.2025,20.11.2025,14:00:00,15:59:00,,MARTES N611 CALLE79,,JUEVES N611 CALLE79,,,
2025-2,FAFCE,AFA00391,AFA00391C301,2,C3,NUCLEAR, CUSTOM RELATION MANAG C3G1,,,,,,,,,,,,,MORENO CEBALLOS HAIDY JOHANNA,21.07.2025,17.09.2025,18:00:00,19:59:00,LUNES N407 CALLE79,,MIERCOLES N407 CALLE79,,,,
2025-2,FAFCE,AFA00391,AFA00391C401,2,C4,NUCLEAR, CUSTOM RELATION MANAG C4G1,,,,,,,,,,,,,MORENO CEBALLOS HAIDY JOHANNA,23.09.2025,20.11.2025,18:00:00,19:59:00,,MARTES N408 CALLE79,,JUEVES N408 CALLE79,,,
2025-2,FAFCE,AFA00392,AFA00392C401,3,C4,NUCLEAR,GERENCIA DE PROD Y DE CATEG C4G1,,,,,,,,,,,,,MORENO CEBALLOS HAIDY JOHANNA,22.09.2025,21.11.2025,18:00:00,19:59:00,LUNES  ,,MIERCOLES  ,,VIERNES  ,,
2025-2,FAFCE,AFA00393,AFA00393C301,2,C3,NUCLEAR, MERC ESTR Y PLAN DEL MAR C3G1,,,,,,,,,,,,,MORENO CEBALLOS HAIDY JOHANNA,22.07.2025,18.09.2025,18:00:00,19:59:00,,MARTES N511 CALLE79,,JUEVES N511 CALLE79,,,
2025-2,FAFCE,AFA00393,AFA00393C401,2,C4,NUCLEAR, MERC ESTR Y PLAN DEL MAR C4G1,,,,,,,,,,,,,MORENO CEBALLOS HAIDY JOHANNA,23.09.2025,20.11.2025,20:00:00,21:59:00,,MARTES N511 CALLE79,,JUEVES N511 CALLE79,,,
2025-2,FAFCE,AFA00395,AFA00395C401,3,C4,NUCLEAR,GEREN ESTRAT D VENTAS C4G1,,,,,,,,,,,,,MORENO CEBALLOS HAIDY JOHANNA,26.09.2025,21.11.2025,18:00:00,19:59:00,,,,,VIERNES N403 CALLE79,,
2025-2,FAFCE,AFA00395,AFA00395C401,3,C4,NUCLEAR,GEREN ESTRAT D VENTAS C4G1,,,,,,,,,,,,,MORENO CEBALLOS HAIDY JOHANNA,22.09.2025,19.11.2025,18:00:00,19:59:00,LUNES N406 CALLE79,,MIERCOLES N406 CALLE79,,,,
2025-2,FAFCE,AFA00396,AFA00396C301,3,C3,NUCLEAR, MARKETING DE PUNTO DE VEN C3G1,,,,,,,,,,,,,MORENO CEBALLOS HAIDY JOHANNA,22.07.2025,18.09.2025,18:00:00,19:59:00,,MARTES N715 CALLE79,,JUEVES N715 CALLE79,,,
2025-2,FAFCE,AFA00396,AFA00396C401,3,C4,NUCLEAR, MARKETING DE PUNTO DE VEN C4G1,,,,,,,,,,,,,MORENO CEBALLOS HAIDY JOHANNA,23.09.2025,20.11.2025,20:00:00,21:59:00,,MARTES N715 CALLE79,,JUEVES N715 CALLE79,,,
2025-2,FAFCE,AFA00397,AFA00397C301,2,C3,NUCLEAR, GER D PREC Y REVEN MAN C3G1,,,,,,,,,,,,,MORENO CEBALLOS HAIDY JOHANNA,23.07.2025,19.09.2025,18:00:00,19:59:00,,,MIERCOLES L510 CALLE78,,VIERNES L510 CALLE78,,
2025-2,FAFCE,AFA00397,AFA00397C302,2,C3,NUCLEAR, GER D PREC Y REVEN MAN C3G2,,,,,,,,,,,,,MORENO CEBALLOS HAIDY JOHANNA,23.07.2025,17.09.2025,08:00:00,09:59:00,,,MIERCOLES L501 CALLE78,,,,
2025-2,FAFCE,AFA00397,AFA00397C302,2,C3,NUCLEAR, GER D PREC Y REVEN MAN C3G2,,,,,,,,,,,,,MORENO CEBALLOS HAIDY JOHANNA,21.07.2025,15.09.2025,08:00:00,09:59:00,LUNES L920 CALLE78,,,,,,
2025-2,FAFCE,AFA00397,AFA00397C401,2,C4,NUCLEAR, GER D PREC Y REVEN MAN C4G1,,,,,,,,,,,,,MORENO CEBALLOS HAIDY JOHANNA,23.09.2025,20.11.2025,14:00:00,15:59:00,,MARTES L811 CALLE78,,JUEVES L811 CALLE78,,,
2025-2,FAFCE,AFA00401,AFA00401S201,4,S2,NUCLEAR,INVESTIGACION DE MERCADOS S2G1,,,,,,,,,,,,,MORENO CEBALLOS HAIDY JOHANNA,22.07.2025,20.11.2025,10:00:00,11:59:00,,MARTES N612 CALLE79,,JUEVES N612 CALLE79,,,
2025-2,FAFCE,AFA00431,AFA00431C401,3,C4,NUCLEAR, FUNDAMENTOS DE MERCADOS C4G1,,,,,,,,,,,,,MORENO CEBALLOS HAIDY JOHANNA,22.09.2025,21.11.2025,12:00:00,13:59:00,LUNES  ,,MIERCOLES  ,,VIERNES  ,,
2025-2,FAFCE,AFA00460,AFA00460S201,3,S2,NUCLEAR, INTERNA BUSINESS LAW S2G1,,,,,,,,,,,,,PASTRANA GRANADOS MONICA ALEJANDRA,22.07.2025,20.11.2025,18:00:00,19:29:00,,MARTES N610 CALLE79,,JUEVES N610 CALLE79,,,
2025-2,FAFCE,AFA00480,AFA00480C301,3,C3,NUCLEAR, FUNDAMENTOS DE MERCADEO C3G1,,,,,,,,,,,,,MORENO CEBALLOS HAIDY JOHANNA,23.07.2025,19.09.2025,18:00:00,19:59:00,,,MIERCOLES N615 CALLE79,,VIERNES N615 CALLE79,,
2025-2,FAFCE,AFA00480,AFA00480C301,3,C3,NUCLEAR, FUNDAMENTOS DE MERCADEO C3G1,,,,,,,,,,,,,MORENO CEBALLOS HAIDY JOHANNA,21.07.2025,15.09.2025,18:00:00,19:59:00,LUNES N508 CALLE79,,,,,,
2025-2,FAFCE,AFA00480,AFA00480C302,3,C3,NUCLEAR, FUNDAMENTOS DE MERCADEO C3G2,,,,,,,,,,,,,MORENO CEBALLOS HAIDY JOHANNA,23.07.2025,17.09.2025,08:00:00,09:59:00,,,MIERCOLES L503 CALLE78,,,,
2025-2,FAFCE,AFA00480,AFA00480C302,3,C3,NUCLEAR, FUNDAMENTOS DE MERCADEO C3G2,,,,,,,,,,,,,MORENO CEBALLOS HAIDY JOHANNA,21.07.2025,19.09.2025,08:00:00,09:59:00,LUNES L804 CALLE78,,,,VIERNES L804 CALLE78,,
2025-2,FAFCE,AFA00480,AFA00480C401,3,C4,NUCLEAR, FUNDAMENTOS DE MERCADEO C4G1,,,,,,,,,,,,,MORENO CEBALLOS HAIDY JOHANNA,26.09.2025,21.11.2025,18:00:00,19:59:00,,,,,VIERNES N612 CALLE79,,
2025-2,FAFCE,AFA00480,AFA00480C401,3,C4,NUCLEAR, FUNDAMENTOS DE MERCADEO C4G1,,,,,,,,,,,,,MORENO CEBALLOS HAIDY JOHANNA,22.09.2025,17.11.2025,18:00:00,19:59:00,LUNES N505 CALLE79,,,,,,
2025-2,FAFCE,AFA00480,AFA00480C401,3,C4,NUCLEAR, FUNDAMENTOS DE MERCADEO C4G1,,,,,,,,,,,,,MORENO CEBALLOS HAIDY JOHANNA,24.09.2025,19.11.2025,18:00:00,19:59:00,,,MIERCOLES N511 CALLE79,,,,
2025-2,FAFCE,AFA00480,AFA00480C402,3,C4,NUCLEAR, FUNDAMENTOS DE MERCADEO C4G2,,,,,,,,,,,,,MORENO CEBALLOS HAIDY JOHANNA,22.09.2025,21.11.2025,16:00:00,17:59:00,LUNES L719 CALLE78,,MIERCOLES L719 CALLE78,,VIERNES L719 CALLE78,,
2025-2,FAFCE,AFA00482,AFA00482C401,2,C4,NUCLEAR, INTERNAT FINANCIAL MANAG C4G1,AFP00450C401,DUMI  INTERNATIONAL FINANCE C4G1,,,,,,,,,,,MATITUY TORRES DIEGO ARMANDO,24.09.2025,19.11.2025,20:00:00,21:59:00,,,MIERCOLES N408 CALLE79,,,,
2025-2,FAFCE,AFA00482,AFA00482C401,2,C4,NUCLEAR, INTERNAT FINANCIAL MANAG C4G1,AFP00450C401,DUMI  INTERNATIONAL FINANCE C4G1,,,,,,,,,,,MATITUY TORRES DIEGO ARMANDO,26.09.2025,21.11.2025,18:00:00,19:59:00,,,,,VIERNES L801 CALLE78,,
2025-2,FAFCE,AFA00482,AFA00482C402,2,C4,NUCLEAR, INTERNAT FINANCIAL MANAG C4G2,,,,,,,,,,,,,MATITUY TORRES DIEGO ARMANDO,24.09.2025,21.11.2025,14:00:00,15:59:00,,,MIERCOLES N412 CALLE79,,VIERNES N412 CALLE79,,
2025-2,FAFCE,AFPN0016,AFA00498C302,2,C3,NUCLEAR, POST ECONO EN TEM CONTE C3G2,,,,,,,,,,,,,RIVERA RUEDA JUAN CARLOS,24.07.2025,18.09.2025,20:00:00,21:59:00,,,,JUEVES N405 CALLE79,,,
2025-2,FAFCE,AFPN0016,AFA00498C302,2,C3,NUCLEAR, POST ECONO EN TEM CONTE C3G2,,,,,,,,,,,,,RIVERA RUEDA JUAN CARLOS,22.07.2025,16.09.2025,20:00:00,21:59:00,,MARTES N612 CALLE79,,,,,
2025-2,FAFCE,AFA00514,AFA00514C301,3,C3,NUCLEAR, PRINCI DE MACROECONO C3G1,,,,,,,,,,,,,RIVERA RUEDA JUAN CARLOS,21.07.2025,19.09.2025,16:00:00,17:59:00,LUNES L818 CALLE78,,,,VIERNES L818 CALLE78,,
2025-2,FAFCE,AFA00514,AFA00514C301,3,C3,NUCLEAR, PRINCI DE MACROECONO C3G1,,,,,,,,,,,,,RIVERA RUEDA JUAN CARLOS,23.07.2025,17.09.2025,16:00:00,17:59:00,,,MIERCOLES L513 CALLE78,,,,
2025-2,FAFCE,AFA00514,AFA00514C401,3,C4,NUCLEAR, PRINCI DE MACROECONO C4G1,,,,,,,,,,,,,RIVERA RUEDA JUAN CARLOS,26.09.2025,21.11.2025,20:00:00,21:59:00,,,,,VIERNES N608 CALLE79,,
2025-2,FAFCE,AFA00514,AFA00514C401,3,C4,NUCLEAR, PRINCI DE MACROECONO C4G1,,,,,,,,,,,,,RIVERA RUEDA JUAN CARLOS,22.09.2025,19.11.2025,20:00:00,21:59:00,LUNES N406 CALLE79,,MIERCOLES N406 CALLE79,,,,
2025-2,FAFCE,AFA00515,AFA00515C301,3,C3,NUCLEAR, PRINCI DE MICROECONO C3G1,,,,,,,,,,,,,RIVERA RUEDA JUAN CARLOS,21.07.2025,19.09.2025,10:00:00,11:59:00,LUNES L719 CALLE78,,,,VIERNES L719 CALLE78,,
2025-2,FAFCE,AFA00515,AFA00515C301,3,C3,NUCLEAR, PRINCI DE MICROECONO C3G1,,,,,,,,,,,,,RIVERA RUEDA JUAN CARLOS,23.07.2025,17.09.2025,10:00:00,11:59:00,,,MIERCOLES  ,,,,
2025-2,FAFCE,AFA00515,AFA00515C401,3,C4,NUCLEAR, PRINCI DE MICROECONO C4G1,,,,,,,,,,,,,RIVERA RUEDA JUAN CARLOS,26.09.2025,21.11.2025,20:00:00,21:59:00,,,,,VIERNES N710 CALLE79,,
2025-2,FAFCE,AFA00515,AFA00515C401,3,C4,NUCLEAR, PRINCI DE MICROECONO C4G1,,,,,,,,,,,,,RIVERA RUEDA JUAN CARLOS,22.09.2025,19.11.2025,20:00:00,21:59:00,LUNES N512 CALLE79,,MIERCOLES N512 CALLE79,,,,
2025-2,FAFCE,AFA00517,AFA00517C401,2,C4,NUCLEAR,SEMINARIO ECONOMICO C4G1,,,,,,,,,,,,,RIVERA RUEDA JUAN CARLOS,23.09.2025,20.11.2025,10:00:00,11:59:00,,MARTES  ,,JUEVES  ,,,
2025-2,FAFCE,AFA00517,AFA00517C402,2,C4,NUCLEAR,SEMINARIO ECONOMICO C4G2,,,,,,,,,,,,,RIVERA RUEDA JUAN CARLOS,23.09.2025,20.11.2025,18:00:00,19:59:00,,MARTES  ,,JUEVES  ,,,
2025-2,FAFCE,AFA00528,AFA00528C301,2,C3,NUCLEAR, GESTION DE INV Y DEL FIN C3G1,,,,,,,,,,,,,MATITUY TORRES DIEGO ARMANDO,24.07.2025,18.09.2025,18:00:00,19:59:00,,,,JUEVES SAL_BLOOMB CALLE79,,,
2025-2,FAFCE,AFA00528,AFA00528C301,2,C3,NUCLEAR, GESTION DE INV Y DEL FIN C3G1,,,,,,,,,,,,,MATITUY TORRES DIEGO ARMANDO,22.07.2025,16.09.2025,18:00:00,19:59:00,,MARTES  ,,,,,
2025-2,FAFCE,AFA00528,AFA00528C302,2,C3,NUCLEAR, GESTION DE INV Y DEL FIN C3G2,,,,,,,,,,,,,MATITUY TORRES DIEGO ARMANDO,22.07.2025,18.09.2025,10:00:00,11:59:00,,MARTES SAL_BLOOMB CALLE79,,JUEVES SAL_BLOOMB CALLE79,,,
2025-2,FAFCE,AFA00530,AFA00530C301,3,C3,NUCLEAR, TEOR Y COMPORT ORGAN C3G1,AFA02033C301,DUMI  TEORIA Y COMPORT ORGANIZ C3G1,,,,,,,,,,,VELAZQUEZ ESPINOZA NOE,21.07.2025,19.09.2025,10:00:00,11:59:00,LUNES L902 CALLE78,,,,VIERNES L902 CALLE78,,
2025-2,FAFCE,AFA00530,AFA00530C301,3,C3,NUCLEAR, TEOR Y COMPORT ORGAN C3G1,AFA02033C301,DUMI  TEORIA Y COMPORT ORGANIZ C3G1,,,,,,,,,,,VELAZQUEZ ESPINOZA NOE,23.07.2025,17.09.2025,10:00:00,11:59:00,,,MIERCOLES  ,,,,
2025-2,FAFCE,AFA00530,AFA00530C401,3,C4,NUCLEAR, TEOR Y COMPORT ORGAN C4G1,AFA02033C401,DUMI  TEORIA Y COMPORT ORGANIZ C4G1,,,,,,,,,,,VELAZQUEZ ESPINOZA NOE,22.09.2025,20.11.2025,20:00:00,21:59:00,LUNES L818 CALLE78,,MIERCOLES L818 CALLE78,JUEVES L818 CALLE78,,,
2025-2,FAFCE,AFA02019,AFA02019S201,4,S2,NUCLEAR, ENTORNO ECONOMICO S2G1,,,,,,,,,,,,,RIVERA RUEDA JUAN CARLOS ,22.07.2025,20.11.2025,18:00:00,19:59:00,,MARTES N509 CALLE79,,JUEVES N509 CALLE79,,,
2025-2,FAFCE,AFA02019,AFA02019S202,4,S2,NUCLEAR, ENTORNO ECONOMICO S2G2,,,,,,,,,,,,,RIVERA RUEDA JUAN CARLOS ,22.07.2025,20.11.2025,12:00:00,13:59:00,,MARTES N615 CALLE79,,JUEVES N615 CALLE79,,,
2025-2,FAFCE,AFA02022,AFA02022C301,2,C3,NUCLEAR, MATE PARA LAS CIEN ECO C3G1,,,,,,,,,,,,,MATITUY TORRES DIEGO ARMANDO,22.07.2025,18.09.2025,18:00:00,19:59:00,,MARTES N307 CALLE79,,JUEVES N307 CALLE79,,,
2025-2,FAFCE,AFA02022,AFA02022C401,2,C4,NUCLEAR, MATE PARA LAS CIEN ECO C4G1,,,,,,,,,,,,,MATITUY TORRES DIEGO ARMANDO,25.09.2025,20.11.2025,14:00:00,15:59:00,,,,JUEVES L801 CALLE78,,,
2025-2,FAFCE,AFA02022,AFA02022C401,2,C4,NUCLEAR, MATE PARA LAS CIEN ECO C4G1,,,,,,,,,,,,,MATITUY TORRES DIEGO ARMANDO,23.09.2025,18.11.2025,14:00:00,15:59:00,,MARTES N412 CALLE79,,,,,
2025-2,FAFCE,AFA02023,AFA02023S201,7,S2,NUCLEAR,CONTABILIDAD FINANCIERA S2G1,,,,,,,,,,,,,MATITUY TORRES DIEGO ARMANDO,25.07.2025,21.11.2025,06:00:00,07:59:00,,,,,VIERNES N611 CALLE79,,
2025-2,FAFCE,AFA02023,AFA02023S201,7,S2,NUCLEAR,CONTABILIDAD FINANCIERA S2G1,,,,,,,,,,,,,MATITUY TORRES DIEGO ARMANDO,22.07.2025,20.11.2025,06:00:00,08:29:00,,MARTES N614 CALLE79,,JUEVES N614 CALLE79,,,
2025-2,FAFCE,AFA02023,AFA02023S202,7,S2,NUCLEAR,CONTABILIDAD FINANCIERA S2G2,,,,,,,,,,,,,MATITUY TORRES DIEGO ARMANDO,22.07.2025,20.11.2025,18:00:00,20:29:00,,MARTES N507 CALLE79,,JUEVES N507 CALLE79,,,
2025-2,FAFCE,AFA02023,AFA02023S202,7,S2,NUCLEAR,CONTABILIDAD FINANCIERA S2G2,,,,,,,,,,,,,MATITUY TORRES DIEGO ARMANDO,25.07.2025,21.11.2025,18:00:00,19:59:00,,,,,VIERNES N507 CALLE79,,
2025-2,FAFCE,AFA02024,AFA02024S201,8,S2,NUCLEAR, DER PARA LAS CIE ECO Y CO S2G1,,,,,,,,,,,,,MATITUY TORRES DIEGO ARMANDO,21.07.2025,21.11.2025,20:00:00,21:59:00,LUNES N612 CALLE79,,MIERCOLES N612 CALLE79,JUEVES N612 CALLE79,VIERNES N612 CALLE79,,
2025-2,FAFCE,AFA02024,AFA02024S202,8,S2,NUCLEAR, DER PARA LAS CIE ECO Y CO S2G2,,,,,,,,,,,,,MATITUY TORRES DIEGO ARMANDO,22.07.2025,20.11.2025,10:00:00,11:59:00,,MARTES N505 CALLE79,MIERCOLES N505 CALLE79,JUEVES N505 CALLE79,,,
2025-2,FAFCE,AFA02024,AFA02024S202,8,S2,NUCLEAR, DER PARA LAS CIE ECO Y CO S2G2,,,,,,,,,,,,,MATITUY TORRES DIEGO ARMANDO,25.07.2025,21.11.2025,10:00:00,11:59:00,,,,,VIERNES L513 CALLE78,,
2025-2,FAFCE,AFA02026,AFA02026S201,8,S2,NUCLEAR, INFORMES FINANCIEROS S2G1,,,,,,,,,,,,,MATITUY TORRES DIEGO ARMANDO,25.07.2025,21.11.2025,20:00:00,21:59:00,,,,,VIERNES N407 CALLE79,,
2025-2,FAFCE,AFA02026,AFA02026S201,8,S2,NUCLEAR, INFORMES FINANCIEROS S2G1,,,,,,,,,,,,,MATITUY TORRES DIEGO ARMANDO,21.07.2025,19.11.2025,20:00:00,21:59:00,LUNES N411 CALLE79,MARTES N411 CALLE79,MIERCOLES N411 CALLE79,,,,
2025-2,FAFCE,AFA02026,AFA02026S202,8,S2,NUCLEAR, INFORMES FINANCIEROS S2G2,,,,,,,,,,,,,MATITUY TORRES DIEGO ARMANDO,24.07.2025,20.11.2025,14:00:00,15:59:00,,,,JUEVES N412 CALLE79,,,
2025-2,FAFCE,AFA02026,AFA02026S202,8,S2,NUCLEAR, INFORMES FINANCIEROS S2G2,,,,,,,,,,,,,MATITUY TORRES DIEGO ARMANDO,21.07.2025,21.11.2025,14:00:00,15:59:00,LUNES N411 CALLE79,,MIERCOLES N411 CALLE79,,VIERNES N411 CALLE79,,
2025-2,FAFCE,AFA02028,AFA02028S201,7,S2,NUCLEAR, GESTION FINANCIERA S2G1,,,,,,,,,,,,,MATITUY TORRES DIEGO ARMANDO,24.07.2025,20.11.2025,20:00:00,21:59:00,,,,JUEVES L501 CALLE78,,,
2025-2,FAFCE,AFA02028,AFA02028S201,7,S2,NUCLEAR, GESTION FINANCIERA S2G1,,,,,,,,,,,,,MATITUY TORRES DIEGO ARMANDO,22.07.2025,18.11.2025,18:00:00,20:29:00,,MARTES SAL_BLOOMB CALLE79,,,,,
2025-2,FAFCE,AFA02028,AFA02028S201,7,S2,NUCLEAR, GESTION FINANCIERA S2G1,,,,,,,,,,,,,MATITUY TORRES DIEGO ARMANDO,26.07.2025,22.11.2025,07:00:00,09:29:00,,,,,,SABADO AULA-EMPRE-2 ,
2025-2,FAFCE,AFA02028,AFA02028S202,7,S2,NUCLEAR, GESTION FINANCIERA S2G2,,,,,,,,,,,,,MATITUY TORRES DIEGO ARMANDO,21.07.2025,17.11.2025,06:00:00,07:59:00,LUNES SAL_BLOOMB CALLE79,,,,,,
2025-2,FAFCE,AFA02028,AFA02028S202,7,S2,NUCLEAR, GESTION FINANCIERA S2G2,,,,,,,,,,,,,MATITUY TORRES DIEGO ARMANDO,23.07.2025,21.11.2025,06:00:00,08:29:00,,,MIERCOLES SAL_BLOOMB CALLE79,,VIERNES SAL_BLOOMB CALLE79,,
2025-2,FAFCE,AFA02029,AFA02029S201,8,S2,NUCLEAR, ASEGURA DE LA INF S2G1,,,,,,,,,,,,,MATITUY TORRES DIEGO ARMANDO,23.07.2025,19.11.2025,18:00:00,19:59:00,,,MIERCOLES L801 CALLE78,,,,
2025-2,FAFCE,AFA02029,AFA02029S201,8,S2,NUCLEAR, ASEGURA DE LA INF S2G1,,,,,,,,,,,,,MATITUY TORRES DIEGO ARMANDO,21.07.2025,21.11.2025,18:00:00,19:59:00,LUNES N409 CALLE79,,,JUEVES N409 CALLE79,VIERNES N409 CALLE79,,
2025-2,FAFCE,AFA02029,AFA02029S202,8,S2,NUCLEAR, ASEGURA DE LA INF S2G2,,,,,,,,,,,,,MATITUY TORRES DIEGO ARMANDO,21.07.2025,21.11.2025,06:00:00,07:59:00,LUNES  ,,,,VIERNES  ,,
2025-2,FAFCE,AFA02029,AFA02029S202,8,S2,NUCLEAR, ASEGURA DE LA INF S2G2,,,,,,,,,,,,,MATITUY TORRES DIEGO ARMANDO,22.07.2025,20.11.2025,06:00:00,07:59:00,,MARTES N407 CALLE79,,JUEVES N407 CALLE79,,,
2025-2,FAFCE,AFA02030,AFA02030S201,4,S2,NUCLEAR, LABORATORIO CONTABLE S2G1,,,,,,,,,,,,,MATITUY TORRES DIEGO ARMANDO,23.07.2025,21.11.2025,18:00:00,19:59:00,,,MIERCOLES SAL_BLOOMB CALLE79,,VIERNES SAL_BLOOMB CALLE79,,
2025-2,FAFCE,AFA02030,AFA02030S202,4,S2,NUCLEAR, LABORATORIO CONTABLE S2G2,AFPN0122S201,DUMI LABORATORIO CONTABLE S2G1,,,,,,,,,,,MATITUY TORRES DIEGO ARMANDO,21.07.2025,19.11.2025,14:00:00,15:59:00,LUNES SAL_BLOOMB CALLE79,,MIERCOLES SAL_BLOOMB CALLE79,,,,
2025-2,FAFCE,AFA02035,AFA02035S201,4,S2,NUCLEAR, GERENCIA ESTRATEGICA S2G1,AFA00520S201,DUMI  GERENCIA ESTRATEGICA S2G1,,,,,,,,,,,VELAZQUEZ ESPINOZA NOE,22.07.2025,20.11.2025,18:00:00,19:59:00,,MARTES L818 CALLE78,,JUEVES L818 CALLE78,,,
2025-2,FAFCE,AFA02035,AFA02035S202,4,S2,NUCLEAR, GERENCIA ESTRATEGICA S2G2,AFA00520S202,DUMI  GERENCIA ESTRATEGICA S2G2,,,,,,,,,,,VELAZQUEZ ESPINOZA NOE,22.07.2025,20.11.2025,10:00:00,11:59:00,,MARTES L502 CALLE78,,JUEVES L502 CALLE78,,,
2025-2,FAFCE,AFA02036,AFA02036C301,3,C3,NUCLEAR,INTERNATIONAL MARK C3G1,,,,,,,,,,,,,MORENO CEBALLOS HAIDY JOHANNA,23.07.2025,19.09.2025,18:00:00,19:59:00,,,MIERCOLES N708 CALLE79,,VIERNES N708 CALLE79,,
2025-2,FAFCE,AFA02036,AFA02036C301,3,C3,NUCLEAR,INTERNATIONAL MARK C3G1,,,,,,,,,,,,,MORENO CEBALLOS HAIDY JOHANNA,21.07.2025,15.09.2025,18:00:00,19:59:00,LUNES N710 CALLE79,,,,,,
2025-2,FAFCE,AFA02036,AFA02036C401,3,C4,NUCLEAR,INTERNATIONAL MARK C4G1,,,,,,,,,,,,,MORENO CEBALLOS HAIDY JOHANNA,22.09.2025,17.11.2025,18:00:00,19:59:00,LUNES N611 CALLE79,,,,,,
2025-2,FAFCE,AFA02036,AFA02036C401,3,C4,NUCLEAR,INTERNATIONAL MARK C4G1,,,,,,,,,,,,,MORENO CEBALLOS HAIDY JOHANNA,24.09.2025,21.11.2025,18:00:00,19:59:00,,,MIERCOLES N608 CALLE79,,VIERNES N608 CALLE79,,
2025-2,FAFCE,AFP00485,AFP00485C401,3,C4,NUCLEAR,MERCADO DE CAPITALES C4G1,,,,,,,,,,,,,MATITUY TORRES DIEGO ARMANDO,22.09.2025,21.11.2025,08:00:00,09:59:00,LUNES N412 CALLE79,,MIERCOLES N412 CALLE79,,VIERNES N412 CALLE79,,
2025-2,FAFCE,AFPN0003,AFPN0003S201,3,S2,NUCLEAR, MICROE DE CONSU Y EMPR S2G1,,,,,,,,,,,,,RIVERA RUEDA JUAN CARLOS,22.07.2025,20.11.2025,10:00:00,11:29:00,,MARTES L509 CALLE78,,JUEVES L509 CALLE78,,,
2025-2,FAFCE,AFPN0003,AFPN0003S202,3,S2,NUCLEAR, MICROE DE CONSU Y EMPR S2G2,,,,,,,,,,,,,RIVERA RUEDA JUAN CARLOS,24.07.2025,20.11.2025,18:00:00,19:29:00,,,,JUEVES N613 CALLE79,,,
2025-2,FAFCE,AFPN0003,AFPN0003S202,3,S2,NUCLEAR, MICROE DE CONSU Y EMPR S2G2,,,,,,,,,,,,,RIVERA RUEDA JUAN CARLOS,22.07.2025,18.11.2025,20:00:00,21:29:00,,MARTES N505 CALLE79,,,,,
2025-2,FAFCE,AFPN0004,AFPN0004S201,4,S2,NUCLEAR, GESTI Y PROSPEC EMPRES S2G1,AFA00457S201,DUMI  INTRODUCC A LA ADM S2G1,,,,,,,,,,,VELAZQUEZ ESPINOZA NOE,22.07.2025,20.11.2025,08:00:00,09:59:00,,MARTES L612 CALLE78,,JUEVES L612 CALLE78,,,
2025-2,FAFCE,AFPN0004,AFPN0004S202,4,S2,NUCLEAR, GESTI Y PROSPEC EMPRES S2G2,AFA00457S202,DUMI  INTRODUCC A LA ADM S2G2,,,,,,,,,,,VELAZQUEZ ESPINOZA NOE,22.07.2025,20.11.2025,08:00:00,09:59:00,,MARTES L502 CALLE78,,JUEVES L502 CALLE78,,,
2025-2,FAFCE,AFPN0004,AFPN0004S203,4,S2,NUCLEAR, GESTI Y PROSPEC EMPRES S2G3,AFA00457S203,DUMI  INTRODUCC A LA ADM S2G3,,,,,,,,,,,VELAZQUEZ ESPINOZA NOE,22.07.2025,20.11.2025,08:00:00,09:59:00,,MARTES L703 CALLE78,,JUEVES L703 CALLE78,,,
2025-2,FAFCE,AFPN0004,AFPN0004S204,4,S2,NUCLEAR, GESTI Y PROSPEC EMPRES S2G4,AFA00457S204,DUMI  INTRODUCC A LA ADM S2G4,,,,,,,,,,,VELAZQUEZ ESPINOZA NOE,21.07.2025,19.11.2025,10:00:00,11:59:00,LUNES L803 CALLE78,,MIERCOLES L803 CALLE78,,,,
2025-2,FAFCE,AFPN0004,AFPN0004S205,4,S2,NUCLEAR, GESTI Y PROSPEC EMPRES S2G5,AFA00457S205,DUMI  INTRODUCC A LA ADM S2G5,,,,,,,,,,,VELAZQUEZ ESPINOZA NOE,22.07.2025,20.11.2025,06:00:00,07:59:00,,MARTES L502 CALLE78,,JUEVES L502 CALLE78,,,
2025-2,FAFCE,AFPN0004,AFPN0004S206,4,S2,NUCLEAR, GESTI Y PROSPEC EMPRES S2G6,AFA00457S206,DUMI  INTRODUCC A LA ADM S2G6,,,,,,,,,,,VELAZQUEZ ESPINOZA NOE,23.07.2025,21.11.2025,14:00:00,15:59:00,,,MIERCOLES L511 CALLE78,,VIERNES L511 CALLE78,,
2025-2,FAFCE,AFPN0004,AFPN0004S207,4,S2,NUCLEAR, GESTI Y PROSPEC EMPRES S2G7,AFA00457S207,DUMI  INTRODUCC A LA ADM S2G7,,,,,,,,,,,VELAZQUEZ ESPINOZA NOE,23.07.2025,21.11.2025,06:00:00,07:59:00,,,MIERCOLES L502 CALLE78,,VIERNES L502 CALLE78,,
2025-2,FAFCE,AFPN0004,AFPN0004S208,4,S2,NUCLEAR, GESTI Y PROSPEC EMPRES S2G8,AFA00457S208,DUMI  INTRODUCC A LA ADM S2G8,,,,,,,,,,,VELAZQUEZ ESPINOZA NOE,21.07.2025,19.11.2025,12:00:00,13:59:00,LUNES L818 CALLE78,,MIERCOLES L818 CALLE78,,,,
2025-2,FAFCE,AFPN0004,AFPN0004S209,4,S2,NUCLEAR, GESTI Y PROSPEC EMPRES S2G9,AFA00457S209,DUMI  INTRODUCC A LA ADM S2G9,,,,,,,,,,,VELAZQUEZ ESPINOZA NOE,23.07.2025,21.11.2025,16:00:00,17:59:00,,,MIERCOLES L703 CALLE78,,VIERNES L703 CALLE78,,
2025-2,FAFCE,AFPN0004,AFPN0004S210,4,S2,NUCLEAR, GESTI Y PROSPEC EMPRES S2G10,AFA00457S210,DUMI  INTRODUCC A LA ADM S2G10,,,,,,,,,,,VELAZQUEZ ESPINOZA NOE,21.07.2025,19.11.2025,18:00:00,19:59:00,LUNES L613 CALLE78,,MIERCOLES L613 CALLE78,,,,
2025-2,FAFCE,AFPN0004,AFPN0004S211,4,S2,NUCLEAR, GESTI Y PROSPEC EMPRES S2G11,AFA00457S211,DUMI  INTRODUCC A LA ADM S2G11,,,,,,,,,,,VELAZQUEZ ESPINOZA NOE,23.07.2025,21.11.2025,20:00:00,21:59:00,,,MIERCOLES L511 CALLE78,,VIERNES L511 CALLE78,,
2025-2,FAFCE,AFPN0004,AFPN0004S212,4,S2,NUCLEAR, GESTI Y PROSPEC EMPRES S2G12,AFA00457S212,DUMI  INTRODUCC A LA ADM S2G12,,,,,,,,,,,VELAZQUEZ ESPINOZA NOE,23.07.2025,21.11.2025,18:00:00,19:59:00,,,MIERCOLES L511 CALLE78,,VIERNES L511 CALLE78,,
